{
  "version": "1.0",
  "process_version": "test-date-1",
  "worker_ctx": {"timezone": "UTC", "db_name": "test_date_db"},
  "graph": {
    "nodes": [
      {"name": "START", "type": "start"},
      {
        "name": "date_now",
        "type": "io",
        "handler": "http_tool",
        "inputs": {"tool": "date", "operation": "now", "format": "iso", "timezone": "UTC"},
        "outputs": {"result": "cycle.dates.now"}
      },
      {
        "name": "date_add",
        "type": "io",
        "handler": "http_tool",
        "inputs": {"tool": "date", "operation": "add", "date": "${cycle.dates.now}", "days": -3},
        "outputs": {"result": "cycle.dates.from"}
      },
      {"name": "END", "type": "end"}
    ],
    "edges": [
      {"from": "START", "to": "date_now"},
      {"from": "date_now", "to": "date_add"},
      {"from": "date_add", "to": "END"}
    ]
  }
}
